raw_character_text,spoken_words
Lisa Simpson,but mr largo thats what my countrys all about
Dewey Largo,what
Homer Simpson,not now marge
Homer Simpson,lisa lisa are you still in there whats the problem did you fall in lisa
Bart Simpson,sorry dad women and children first
Homer Simpson,wha th--
Homer Simpson,where the hell are my keys who stole my keys come on im late for work
Marge Simpson,oh homer youd lose your head if it werent securely fastened to your neck
Bart Simpson,did you check the den
Homer Simpson,the den great idea
Bart Simpson,warm no cold colder ice cold
Homer Simpson,do you know where my keys are
Bart Simpson,no im talking about your breakfast
Bart Simpson,did you try the rumpus room
Homer Simpson,rumpus room great idea
Lisa Simpson,oh dad
Lisa Simpson,here
Marge Simpson,im sorry everybody but ive only got two cupcakes for the three of you
Bart Simpson,well mom one of us has scarfed down more than enough cupcakes over the past three decades to keep him
Homer Simpson,bart
Lisa Simpson,just take mine a simple cupcake will bring me no pleasure
Bart Simpson,oh yeah
Homer Simpson,all right hey hey
Dewey Largo,all right class from the top one and two and three and
Dewey Largo,lisa
Dewey Largo,lisa simpson
Dewey Largo,lisa theres no room for crazy bebop in my country tis of thee
Lisa Simpson,im wailing out for the homeless family living out of its car the iowa farmer whose land has been taken away by unfeeling bureaucrats the west virginia coal miner coughing up his
Dewey Largo,well thats all fine and good but lisa none of those unpleasant people are going to be at the recital next week
Dewey Largo,now class from the top five six seven
Lisa Simpson,every day at noon a bell rings and they herd us in here for feeding time and we sit around like cattle chewing our cuds dreading the inevitable
Bart Simpson,food fight
JANEY,cmon lees what are you waiting for
JANEY,chuck that spaghetti
Lisa Simpson,i choose not to participate
Ms. Barr,lisa we are playing dodge ball here the object of the game is to avoid the ball by weaving or ducking out of its path
Lisa Simpson,in other words to dodge the ball
Ms. Barr,listen missy just tell me why you werent getting out of the way of those balls
Lisa Simpson,im too sad
Ms. Barr,too sad to play dodge ball thats ridiculous now lets see some enthusiasm play ball
Homer Simpson,come on come on lets go
Bart Simpson,in the red trunks with a record of forty-eight wins and no losses the undisputed champ of this house battling bart simpson whoopee whoo whoo whoo and in the lavender trunks with a record of zero wins and forty-eight defeats -- oh correction humiliating defeats -- all of them by knockout
Homer Simpson,must you do this every time
Bart Simpson,homer the human punching bag simpson boo boo hiss
Bart Simpson,and homer is down three seconds folks -- a new record
Homer Simpson,oh no im not down im -- get up you get up come on
Homer Simpson,okay here we go
Bart Simpson,yo chump you back again
Homer Simpson,get out of the way how come hes not ducking ugh wait a minute i cant get my get out of the way stupid
Marge Simpson,homer
Homer Simpson,ohhh get out of the corner
Marge Simpson,but they sent a note from school
Homer Simpson,what did you do this time you little hoodlum oop get out of the way
Bart Simpson,i didnt do it nobody saw me do it theres no way they can prove anything
Marge Simpson,no bart this note isnt about you
Bart Simpson,it isnt there must be some mistake
Bart Simpson,hey youre right this notes about lisa
Homer Simpson,lisa
Homer Simpson,lisa refuses to play dodge ball because she is sad well she doesnt look sad i dont see any tears in her eyes
Lisa Simpson,its not that kind of sad im sorry dad but you wouldnt understand
Homer Simpson,oh sure i would princess i have feelings too you know like my stomach hurts or im going crazy why dont you climb up on daddys knee and tell him all about it
Lisa Simpson,im just wondering whats the point would it make any difference at all if i never existed how can we sleep at night when theres so much suffering in the world
Homer Simpson,well eh ereh
Homer Simpson,come on lisa ride the homer horsey giddiyap whee
Marge Simpson,lisa honey why dont we go upstairs and ill draw you a nice hot bath that helps me when i feel sad
Lisa Simpson,sorry dad i know you mean well
Homer Simpson,thanks for knowing i mean well
Bart Simpson,gee homer looks like you got yourself a real problem on your hands
Homer Simpson,youre right bart vacuum this floor
Bart Simpson,hey man i didnt do anything wrong
Homer Simpson,in times of trouble you got to go with what you know now hop to it boy
Bart Simpson,stupid homer thinks hes so big stupid homer stupid homer ill show him
Bart Simpson,enjoy your bath
Lisa Simpson,no not really
Bart Simpson,oh too bad well i certainly had fun vacuuming maybe now ill get the pleasure of scrubbing your tub
Lisa Simpson,so typical of bart all he thinks about is himself
Bart Simpson,hey dont say stuff like that about me to maggie shes on my side anyway
Lisa Simpson,is not
Bart Simpson,is too
Lisa Simpson,is not
Bart Simpson,is too
Lisa Simpson,is not
Bart Simpson,is too watch ill prove it maggie come to the one you love best
Lisa Simpson,no maggie come here girl come to me
Bart Simpson,come on maggie the choice is obvious
Lisa Simpson,no maggie dont go for the glitter look for substance
Lisa Simpson,all right maggie just go to bart
Bart Simpson,exactly come to the one you love
Homer Simpson,oh no come on dont let that boy -- get out of the oh no not again dont dont dont great get over oh geeze
Bart Simpson,gee dad youre really bad at this
Homer Simpson,i am not its just that i couldnt concentrate with that infernal racket lisa lisa
Homer Simpson,lisa what did i tell you about playing that saxamathing in the house
Lisa Simpson,i was just playing the blues dad
Homer Simpson,lisa im sorry i didnt mean to yell go ahead -- play your blues if itll make you happy
Lisa Simpson,no thats okay dad ill just work on my fingering unless my fingers clacking on the keys is too loud for you
Homer Simpson,lets hear it
Homer Simpson,you just clack as loud as you want lis
Lisa Simpson,ive got to find that sound
Lisa Simpson,that was beautiful whats it called
Bleeding Gums Murphy,its a little tune that i call the i never had an italian suit blues
Jacqueline Bouvier,wait margie before you go out that door lets put our happy face on because people know how good a mommy you have by the size of your smile
Homer Simpson,what th
Bart Simpson,put up your dukes homer
Homer Simpson,bart go easy on me im your dad
Bart Simpson,i am going easy on you but youre just so old and slow and weak and pathetic
Homer Simpson,no bart no
Marge Simpson,homer wake up wake up oh my here let me wipe off that drool
Homer Simpson,you know marge getting old is a terrible thing i think the saddest day of my life is when i realized i could beat my dad at most things and bart experienced that at the age of four so why are you still awake
Marge Simpson,well im still trying to figure out whats bothering lisa i dont know barts such a handful and maggie needs attention but all the while our little lisas becoming a young woman
Homer Simpson,oh so thats it this is some kind of underwear thing
Marge Simpson,good night homer
Bleeding Gums Murphy,now -- low b-flat
Bleeding Gums Murphy,okay lisa -- altissimo register
Bleeding Gums Murphy,very nice very nice i once ruptured myself doing that
Lisa Simpson,thanks mr murphy
Bleeding Gums Murphy,my friends call me bleeding gums
Lisa Simpson,ew howd you get a name like that
Bleeding Gums Murphy,well let me put it this way you ever been to the dentist
Lisa Simpson,yeah
Bleeding Gums Murphy,not me i suppose i should go to one but i got enough pain in my life as it is
Lisa Simpson,i have problems too
Bleeding Gums Murphy,well i cant help you kid im just a terrific horn player with tons of soul but i can jam with you
Lisa Simpson,okay
Bleeding Gums Murphy,oh im so lonely since my baby left me i got no money and nothing is free oh i been so lonely since the day i was born all i got is this rusty this rusty old horn
Lisa Simpson,i got a bratty brother he bugs me every day and this mornin my own mother she gave my last cupcake away my dad acts like he belongs he belongs in the zoo im the sadest kid in grade number two
Bart Simpson,aw come on ill cheer you up
Bleeding Gums Murphy,you know you play pretty well for someone with no real problems
Lisa Simpson,yeah but i dont feel any better
Bleeding Gums Murphy,the blues isnt about feeling better its about making other people feel worse and making a few bucks while youre at it which reminds me if youre ever in the neighborhood im playing at a little club called the jazz hole
Marge Simpson,lisa get away from that jazzman
Lisa Simpson,but mom cant i stay a little longer
Marge Simpson,come on come on we were worried about you nothing personal i just fear the unfamiliar
Newsman,todays fire raced through downtown springfield gutting symphony hall the springfield museum of natural history the springfield arts center
Newsman,and barneys bowl-a-rama
Newsman,fire officials said the two-alarm blaze took them more than an hour to get under control
Homer Simpson,oh no marge
Homer Simpson,marge are you all right
Marge Simpson,no im very upset
Homer Simpson,then youve heard oh god what are we doing to do the lanes were kinda warped but oh the food
Marge Simpson,im upset about lisa
Homer Simpson,oh me too
Bart Simpson,me three what are we talking about
Homer Simpson,bart
Marge Simpson,do you think youre being nice enough to your sister bart
Bart Simpson,oh yeah easy
Marge Simpson,you do love her dont you
Bart Simpson,oh mom
Marge Simpson,well you do dont you
Bart Simpson,dont make me say it i know the answer you know the answer he knows the answer lets just drop it okay
Marge Simpson,okay bart you dont have to say it but you do have to have a loving attitude be nice to your sister
Bart Simpson,okey-dokey
Marge Simpson,go on bart no time like the present
Bart Simpson,hi man
Lisa Simpson,i dont want your pity
Lisa Simpson,how
Moe Szyslak,yeah moes tavern moe speaking
Bart Simpson,is jacques there
Moe Szyslak,who
Bart Simpson,jacques last name strap
Moe Szyslak,hold on uhjacques strap hey guys im looking for a jacques strap
Moe Szyslak,what -- oh wait a minute -- jacques strap its you isnt it you cowardly little runt when i get hold of you i am gonna gut you like a fish and drink your blood
Bart Simpson,wheres your sense of humor man
Marge Simpson,lisa youll be late for band practice lets go
Homer Simpson,gimme some quarters im doing my laundry
Cashier,yeah right
Homer Simpson,wheres the video boxing
Cashier,its over there in the corner but if i were you i really would use those quarters for laundry
Homer Simpson,hey that kids pretty good
Boy Onlooker,good are you kidding over two thousand fights and hes still on his original quarter
Champ,okay whos next
Kids,me me me me me me
Homer Simpson,no me no me
Homer Simpson,listen -- can you teach me to fight like you do
Champ,i dont think so
Homer Simpson,aw come on
Champ,ill tell you what ill do it if you bark like a dog
Homer Simpson,you little ruff ruff ruff
Champ,you got yourself a deal fido
Champ,well looks like youre all out of quarters old man
Homer Simpson,thats okay with the tips youve given me im going to pound the tar out of a certain little smarty pants tonight
Woman,howie i thought i told you to stop wasting your money in this stupid place
Champ,uh-oh sorry mom
Woman,and you a man of your age you should be ashamed of yourself
Homer Simpson,excuse me i think i hear my wife calling
Marge Simpson,now lisa listen to me this is important i want you to smile today
Lisa Simpson,but i dont feel like smiling
Marge Simpson,well it doesnt matter how you feel inside you know its what shows up on the surface that counts thats what my mother taught me take all your bad feelings and push them down all the way down past your knees until youre almost walking on them and then youll fit in and youll be invited to parties and boys will like you and happiness will follow
Marge Simpson,come on you can do better than that
Marge Simpson,ah thats my girl
Lisa Simpson,i feel more popular already
Ralph Wiggum,hey nice smile
Lisa Simpson,thanks
Stan,hey what are you talking to her for shes just going to say something weird
Lisa Simpson,not me
Ralph Wiggum,you know i used to think you were some sort of a brainiac but i guess youre okay
Lisa Simpson,uh-huh
Stan,hey why dont come over to my house after practice you can do my homework
Lisa Simpson,okay
Dewey Largo,five minutes people five minutes now miss simpson i hope we wont have a repeat of yesterdays outburst of unbridled creativity
Lisa Simpson,no sir
Lisa Simpson,wow mom
Dewey Largo,so thats where she gets it
Marge Simpson,lisa i apologize to you i was wrong i take it all back always be yourself you want to be sad honey be sad well ride it out with you and when you get finished feeling sad well still be there from now on let me do the smiling for both of us
Lisa Simpson,okay mom
Marge Simpson,i said you could stop smiling lisa
Lisa Simpson,i feel like smiling
Bart Simpson,im going to knock you out one more time and thats it this is getting boring man
Homer Simpson,just try not to kill me too hard son heh-heh-heh
Bart Simpson,whoa
Homer Simpson,kid tonights not your night
Bart Simpson,all right man you asked for it no more mr nice guy
Homer Simpson,oh oh block it
Bart Simpson,wha the
Homer Simpson,uh-oh you missed me
Homer Simpson,ha ha i got you dont try that i got ya ill block you and the crowd is on its feet as hurricane homer moves in for the kill
Marge Simpson,boys id like your attention please
Homer Simpson,quiet marge this is my big moment
Homer Simpson,bart-the-bloody-pulp simpson is on the ropes hes hoping ill put him out of his misery well youre in luck bart here comes my right
Homer Simpson,oh noooo
Homer Simpson,my game my game i coulda beat the boy marge how could you i was so close
Marge Simpson,im sorry but this is more important than that silly loud game
Bart Simpson,youre right mom id just like to use this occasion to announce my retirement undefeated from the world of video boxing
Marge Simpson,oh calm down homer lisa has an idea that she thinks would be fun for the whole family
Bleeding Gums Murphy,this next song was written by a friend of mine one of the great little ladies of jazz
Bleeding Gums Murphy,i got this bratty brother he bugs me every day and this mornin my own mother gave my last cupcake away my dad acts like he belongs he belongs in the zoo
Homer Simpson,what
Bleeding Gums Murphy,im the saddest kid in grade number two
